"scientific.name","common.name","observed.on","location","latitude","longitude","url"
"Polypodium appalachianum","appalachian rockcap fern",2024-07-07,"Acadia National Park, Mount Desert, ME, US",44.3406890837,-68.2499077999,"https://www.inaturalist.org/observations/227869593"
"Monotropa hypopitys","pinesap",2024-07-06,"Acadia National Park, Bar Harbor, ME, US",44.3381716667,-68.0667195,"https://www.inaturalist.org/observations/227651619"
"Platanthera clavellata","small green wood orchid",2024-07-05,"Acadia National Park, Mount Desert, ME, US",44.3167033333,-68.2877883333,"https://www.inaturalist.org/observations/227380605"
"Rhodiola rosea","roseroot",2024-07-04,"Winter Harbor, ME, USA",44.332538334,-68.0507047468,"https://www.inaturalist.org/observations/227194877"
"Rhodiola rosea","roseroot",2024-07-04,"Acadia National Park, Bar Harbor, ME, US",44.3325166667,-68.0508945,"https://www.inaturalist.org/observations/227160898"
